{
  "schema_version": "0.1.0",
  "profile_id": "profile:clg-synthetic-grs002",
  "version": "0.1.0",
  "environment": "synthetic",
  "status": "test_only",
  "live_intake_enabled": false,
  "enforcement": "report_only",
  "repository_id": "synthetic/governance-lifecycle",
  "allowed_contexts": [
    "test"
  ],
  "allowed_producers": [
    "synthetic-grs002-fixture"
  ],
  "minimum_trust_level": "provenance_verified",
  "required_checks": [
    "subject_identity_complete",
    "content_digest_verified",
    "producer_run_resolved",
    "commit_matches_run",
    "artifact_belongs_to_run",
    "baseline_ref_resolved",
    "freshness_evaluated",
    "replay_key_unique",
    "custody_recorded"
  ],
  "maximum_age_seconds": 86400,
  "maximum_future_skew_seconds": 0,
  "version_comparison": "exact",
  "replay_policy": "same_identity_same_digest_only",
  "approval_channel": "synthetic_fixture",
  "role_binding": {
    "id": "binding:clg-synthetic",
    "version": "0.1.0",
    "environment": "synthetic",
    "repository_id": "synthetic/governance-lifecycle",
    "assignments": {
      "remediation_decider": "test-human:decision-owner",
      "closure_approver": "test-human:closure-owner"
    }
  }
}
